Job_Key,Title,Company,Rating,Review_Count,Location,Is_Remote,Salary_Text,Salary_Min,Salary_Max,Job_Type,Date_Posted,Date_Created,Skills_Detected,Summary,Link
d333691db01aa201,Python Developer,Hiscope Enterprises,0.0,0,Remote,True,25 - 40 (HOURLY),25.0,40.0,"Full-time, Part-time, Temporary, Contract",2026-01-09,16 days ago,"Azure, AWS, Cross-functional collaboration, Windows, C#, Managing IT infrastructure, Application design, IT, Software testing, Software troubleshooting, Linux administration, Cross-functional communication, Web applications, Cloud infrastructure implementation, Business requirements, Version control, Application deployment, Communication skills, Implementing web services, Scalability, Computer networking, Database management, Ruby on Rails, Linux, Python, System maintenance, SQL, Java, Agile software development, Express.js, IT infrastructure, Scalable systems, React Express, SVN, C++, GitHub, Technology security practices, Database software proficiency, Access control implementation","We are seeking a dynamic and innovative Python Developer to join our vibrant technology team.  In this role, you will be at the forefront of designing,…",https://www.indeed.com/viewjob?jk=d333691db01aa201
838cbed6b484cdd1,Software Engineer (Junior),Terran Robotics Inc.,0.0,0,Remote,True,70000 - 110000 (YEARLY),70000.0,110000.0,,2025-08-29,30+ days ago,"Distributed systems, Dashboard development, JavaScript, Sensors, Robotic systems, Software coding, APIs, Python, Automation, AI, Integration testing","Interest in automation, testing, and developer experience.  Familiarity with LLMs, AI coding assistants, or developer tooling.  $70,000 - $110,000 per year.",https://www.indeed.com/viewjob?jk=838cbed6b484cdd1
5a7eb091eeb33f26,Python Developer,Odixcity Consulting,0.0,0,Remote,True,400000 - 600000 (YEARLY),400000.0,600000.0,,2026-01-15,10 days ago,"Unit testing, Machine learning, Azure, AWS, Git, Continuous integration, Microservices, Google Cloud Platform, Integration testing, RabbitMQ, MongoDB, Kafka, Version control, Scalability, Docker, Django, Implementing APIs, Developing data pipelines, Information security, Flask, Data interpretation, Developing and maintaining backend systems, Scalable systems, PostgreSQL, MySQL","Collaborate with front-end developers, designers, and product managers.  We are looking for a talented Python Developer to join our engineering team and help…",https://www.indeed.com/viewjob?jk=5a7eb091eeb33f26
94901d310f555178,Python Developer Advocate,SerpApi,0.0,0,"Austin, TX",True,100000 - 125000 (YEARLY),100000.0,125000.0,,2025-10-03,30+ days ago,"Zoom, Content creation, Figma, Participating in conferences, Community engagement, Digital marketing, GitHub, Online blogs, SDKs, Python, APIs, Sponsorships, Communication platforms, Slack",Familiarity with a developer relations role and digital marketing is a plus.  Design and implement a developer-focused strategy to grow SerpApi’s presence in the…,https://www.indeed.com/viewjob?jk=94901d310f555178
baa8cd7a6efd8f7f,Backend Python Developer – Remote,Jarvis Recruitment,0.0,0,"New York, NY",True,150000 - 190000 (YEARLY),150000.0,190000.0,,2025-03-11,3 days ago,"SaaS, Continuous Delivery (CD) implementation, Azure, AWS, Cross-functional collaboration, Microservices, Machine learning libraries, PyTorch, Google Cloud Platform, Application design, Machine learning frameworks, NoSQL, Cross-functional communication, Communication skills, Scalability, Docker, GraphQL, Implementing APIs, Mentoring, AI, JavaScript frameworks, Developing and maintaining backend systems, SQL, TensorFlow, Scalable systems, Database software proficiency",Conduct code reviews and mentor junior developers.  Work closely with front-end developers to integrate Python-based backends with React applications.,https://www.indeed.com/viewjob?jk=baa8cd7a6efd8f7f
2a39321851083174,Software Developer,Princeton10,0.0,0,"Philadelphia, PA",True,98000 - 125000 (YEARLY),98000.0,125000.0,,2026-01-21,4 days ago,"Data structures, .NET, Azure, AWS, Cross-functional collaboration, Software documentation, Engineering, Google Cloud Platform, APIs, Cross-functional communication, Computer science, Communication skills, Bachelor's degree, Python, Computer Science, Developing and maintaining backend systems, TypeScript, JavaScript, Technical troubleshooting support, Project stakeholder communication, Regression testing","Ensure assigned work is complete, stable, and ready for review before presenting it to senior developers or the broader team.  Interested in working with us?",https://www.indeed.com/viewjob?jk=2a39321851083174
7b6b42edb97c93e4,Python Developer,ICF,3.4,680,"Reston, VA 20190",True,98614 - 167644 (YEARLY),98614.0,167644.0,,2025-12-01,30+ days ago,"Databricks, Information Systems, Unit testing, Continuous Delivery (CD) implementation, Azure, Cross-functional collaboration, Math, Microservices, Mathematics, Integration testing, Data model design, Application design, Cross-functional communication, Responsive design, Web applications, Computer science, Implementing web services, Scalability, Docker, Django, Management Information Systems, Data modeling, Spring Boot, Bachelor's degree, Flask, Cloud Native Design, Computer Science, JavaScript frameworks, Developing and maintaining backend systems, SQL, Agile software development, Cloud development, Scalable systems, Hibernate, Database software proficiency, Continuous improvement, DevSecOps Practices",As a Python Developer at ICF you play the central role in driving innovation and using technology to drive connections through a multi-channel experience.,https://www.indeed.com/viewjob?jk=7b6b42edb97c93e4
0855934e18c5f835,Software Engineering L5 - GenAI Platform,Netflix,3.9,838,Remote,True,388000 - 619000 (YEARLY),388000.0,619000.0,,2025-12-12,30+ days ago,"Distributed computing, Machine learning, Continuous Delivery (CD) implementation, Cross-functional collaboration, Prompt engineering, Model deployment, Application design, Analysis skills, gRPC, Host/hostess experience, Cross-functional communication, Application deployment, Scalability, GraphQL, Implementing APIs, SDKs, Python, AI, Heavy lifting, Java, Scalable systems, Generative AI",We are seeking a Software Engineer to help build a developer platform that will provide the building blocks for Netflix to efficiently create GenAI applications…,https://www.indeed.com/viewjob?jk=0855934e18c5f835
a1d638023774bf07,US Tech - Backend Developer,PRICE WATERHOUSE COOPERS,3.9,10222,"Montpelier, VT",True,55000 - 187000 (YEARLY),55000.0,187000.0,,2026-01-22,2 days ago,"Statistical modeling, Cross-functional collaboration, Decision making, Data transformation, Client relationship development, Model deployment, Machine learning/AI-based analysis, Data visualization projects, UI development, Customer relationship building, Cross-functional communication, Scalability, Predictive analytics, Team development, Data visualization, MLOps, Mentoring, Bachelor's degree, Python, AI, Developing and maintaining backend systems, Statistics, Data-driven decision making, Generative AI","At PwC, our people in data and analytics engineering focus on leveraging advanced technologies and techniques to design and develop robust data solutions for…",https://www.indeed.com/viewjob?jk=a1d638023774bf07
7d69a78564332aa6,C# Developer,Capgemini,3.7,10570,"Atlanta, GA",True,62200 - 131560 (YEARLY),62200.0,131560.0,,2026-01-21,4 days ago,"Data structures, Cross-functional collaboration, Engineering, C#, Application design, Software testing, Engineering testing, Computer science, Application deployment, Communication skills, Scalability, Analysis (software development lifecycle), Research & development, Bachelor's degree, Python, Computer Science, Software Engineering, Algorithm design, Agile software development, Scalable systems, C++, Stakeholder engagement, Continuous improvement","Atlanta, Austin, Bellevue, Berwyn, Bridgewater, Brooklyn, Burlington, Chicago, Columbia, Dallas, Dayton - Sogeti US, Guaynabo, Houston, Irving, Mclean,…",https://www.indeed.com/viewjob?jk=7d69a78564332aa6
3f2e1b7106cb286e,Senior Python Backend Developer,The Motley Fool,4.3,41,Remote,True,90 - 100 (HOURLY),90.0,100.0,,2025-11-07,30+ days ago,"High availability, Cryptocurrency, Continuous Delivery (CD) implementation, AWS, Cross-functional collaboration, Microservices, RDS database, Developing automated testing protocols, Business requirements, Communication skills, Team management, System performance monitoring, Scalability, Docker, Django, DynamoDB, Implementing APIs, Next.js, High availability architecture, IT system monitoring, Flask, Redis, AI, Developing and maintaining backend systems, SQL, Scalable systems, Failover system","The Motley Fool is seeking a Senior Python Developer to help us develop APIs and microservices using Python-based frameworks such as FastAPI, Django, or Flask.",https://www.indeed.com/viewjob?jk=3f2e1b7106cb286e
e237be5cba98a0b1,Fullstack Developer,Uncrowned King Int'l Ltd,0.0,0,Remote,True,70000 - 150000 (YEARLY),70000.0,150000.0,,2026-01-15,10 days ago,"Azure, AWS, Cross-functional collaboration, Google Cloud Platform, Mobile application development, Cross-functional communication, Responsive design, Web applications, Mobile product development, Communication skills, Scalability, Vue.js, Python, Automation, AI, Developing and maintaining backend systems, Node.js, Scalable systems, High school diploma or GED","We are looking for a skilled Fullstack Developer to design, develop, and deploy responsive web and mobile applications while integrating AI and automation using…",https://www.indeed.com/viewjob?jk=e237be5cba98a0b1
4d909d455abde919,Software Developer,Advantage Group International,0.0,0,Remote,True,100000 - 120000 (YEARLY),100000.0,120000.0,,2025-11-21,30+ days ago,"Organizational skills, Automating deployment processes, Continuous Delivery (CD) implementation, Git, Technical solutions implementation, Nuxt.js, Tailwind CSS, Application design, Software architecture, UI development, Lean management, Maven, Web applications, Business requirements, Communication skills, Implementing web services, Django, Mentoring, SQL databases, Linux, System maintenance, AI, Developing and maintaining backend systems, Engineering automation testing, Agile software development, PostgreSQL, MySQL",We’re looking for a versatile full-stack developer with 4+ years of experience and a strong record of delivering high-quality production systems.,https://www.indeed.com/viewjob?jk=4d909d455abde919
fd839dc5430973a8,Full-Stack Developer (Python & React),Flexday,0.0,0,Remote,True,N/A,,,,2024-12-04,30+ days ago,"Unit testing, Containerization, Git, Cross-functional collaboration, Continuous integration, Full-stack development, Integration testing, Application design, ECMAScript, UI development, Cross-functional communication, NPM, MongoDB, Version control, Communication skills, Scalability, Implementing APIs, Python, TypeScript, Scalable systems, Technical troubleshooting support, PostgreSQL, MySQL","Collaborate with designers, product managers, and other developers to build user-friendly interfaces and seamless APIs.",https://www.indeed.com/viewjob?jk=fd839dc5430973a8
dcfc8e9e87a4cb56,"Software Developer (Virtual, Full Time)",WEALTHCOUNSEL LLC,0.0,0,Remote,True,100000 - 120000 (YEARLY),100000.0,120000.0,,2026-01-06,19 days ago,"Continuous Delivery (CD) implementation, Git, AWS, Cross-functional collaboration, Root cause analysis, Cloud services, Technical solutions implementation, XQuery, Application design, Software testing, NoSQL, Cross-functional communication, Version control, Computer science, Communication skills, Presentation skills, Bachelor's degree, Python, Vue.js, Computer Science, SQL, TypeScript, Agile software development, System design, Solution architecture design, Technical troubleshooting support, Database software proficiency","WealthCounsel brings together the best - the best drafting software and legal tools, the best educators, the best support staff, and the best collegial…",https://www.indeed.com/viewjob?jk=dcfc8e9e87a4cb56
9d6eac9744bf2a5d,Back-End Developer,Hussmann Corporation,3.5,510,Remote,True,100000 - 160000 (YEARLY),100000.0,160000.0,,2025-11-18,30+ days ago,"Azure, AWS, Microservices, Software documentation, Analysis skills, UI development, Web applications, Cloud infrastructure implementation, MongoDB, Communication skills, Implementing web services, Scalability, Docker, Bachelor's degree, Flask, Vue.js, Debugging, Computer Science, Developing and maintaining backend systems, Software Engineering, Internet of Things, System design, Scalable systems, Front-end development, Technical troubleshooting support, MySQL","Collaboration: Work closely with front-end developers, product experts, and other team members to ensure seamless integration between server-side and client-…",https://www.indeed.com/viewjob?jk=9d6eac9744bf2a5d
c0379c1bffed6699,Python Web App Developer,SAIC,4.0,3177,"El Paso, TX 79925",True,120001 - 160000 (YEARLY),120001.0,160000.0,,2026-01-16,9 days ago,"Databricks, Data lake, Cloud-based systems, Dashboard development, Cross-functional collaboration, HTML, Systems & applications support, Matplotlib, Spark, NumPy, Data visualization software proficiency, Pandas, Azure DevOps proficiency, Application design, Software testing, Power BI, Responsive design, Web applications, Version control, Application deployment, Requirements gathering, Communication skills, Data reporting, Cloud security engineering, Scalability, Seaborn, CSS, Docker, System performance monitoring, Master's degree, D3.js, Azure AD, Data analytics, IT system monitoring, Authentication, Vue.js, System maintenance, Real-time data processing implementation, Computer Science, Plotly, SQL, GitHub Actions, Scalable systems, Data-driven decision making, Technology security practices, Database software proficiency","Clearance Level Must Be Able to Obtain: Public Trust.  In this role, you'll design and develop scalable, user-friendly web applications that enable our…",https://www.indeed.com/viewjob?jk=c0379c1bffed6699
063990dcf00ca563,Python Developer,InfoQuest Consulting Group Inc.,0.0,0,Remote,True,N/A,,,Contract,2023-08-29,30+ days ago,"Cloud-based systems, Docker, Unit testing, REST, Git, Linux, Engineering, SDLC, Bachelor's degree, Flask, Windows, Version control, Application deployment","Senior-level experienced in PyWinRM, SCP, Flask and other python module.  Duration &amp; Type: 3-4 months Contract with a major software industry client.",https://www.indeed.com/viewjob?jk=063990dcf00ca563
8944d68e23ae8442,Python Developer,CEDENT,0.0,0,Remote,True,40 - 60 (HOURLY),40.0,60.0,Contract,2023-04-11,30+ days ago,"Metadata management, Shell Scripting, Continuous Delivery (CD) implementation, Jira, AWS, Cross-functional collaboration, Microservices, Vendor relationship management, SOAP, DevOps, C#, Snowflake, Analysis skills, Software testing, Control-M, ServiceNow, Communication skills, SAS, Implementing web services, Docker, Next.js, Metadata, Python, Automation, SQL, Cloud data warehouses, Vendor management, UNIX, NetSuite, ETL pipeline development, Informatica, Database software proficiency, Business intelligence",They support the architect team in evaluating products on the application side.  The team is hiring a Lead Developer and you will be responsible for working with…,https://www.indeed.com/viewjob?jk=8944d68e23ae8442
a1107b2bf0f792a9,Python API Engineer Contract,AKAASA Technologies,0.0,0,"Boston, MA",True,50 - 50 (HOURLY),50.0,50.0,Contract,2025-11-04,30+ days ago,"Scalability, Multithreading, Scalable systems, Databases, Python, APIs, Test cases, Developing and maintaining backend systems",6+ months contract Skill Requirements: We are looking for skilled Python API engineers with a strong background in backend development.,https://www.indeed.com/viewjob?jk=a1107b2bf0f792a9
65c53e76a5a54c96,A.I Developer,Odixcity Consulting,0.0,0,Remote,True,400000 - 600000 (YEARLY),400000.0,600000.0,,2026-01-15,10 days ago,"Model evaluation, Continuous Delivery (CD) implementation, Azure, AWS, Machine learning libraries, PyTorch, Google Cloud Platform, NumPy, Model deployment, Pandas, Natural language processing, Mobile application development, Machine learning frameworks, Web applications, Application deployment, System performance monitoring, Scalability, Docker, MLOps, IT system monitoring, AI, Keras, Computer vision, Project stakeholder communication, Generative AI","In this role, you will work closely with data scientists, engineers, and product teams to develop machine learning models and AI-powered features.",https://www.indeed.com/viewjob?jk=65c53e76a5a54c96
19876f092bdacd87,"Software Developer, Back End",Company3,0.0,0,"Santa Monica, CA",True,94000 - 141000 (YEARLY),94000.0,141000.0,,2025-12-09,30+ days ago,"Automating deployment processes, Unit testing, Continuous Delivery (CD) implementation, Git, AWS CloudFormation, Cross-functional collaboration, Cloud services, Amazon CloudWatch, Amazon EKS, Cross-functional communication, AWS Lambda, MongoDB, Version control, Communication skills, Docker, DynamoDB, Amazon Simple Notification Service (SNS), Flask, S3, Developing and maintaining backend systems, Terraform, Amazon ECS, PostgreSQL","Company 3, including its various business units and family of brands, provides a full range of Creative Services for content creators, including conceptual…",https://www.indeed.com/viewjob?jk=19876f092bdacd87
f3fdec263b1faf11,Full Stack Developer,Patrick J McGovern Foundation,0.0,0,Remote,True,120000 - 145000 (YEARLY),120000.0,145000.0,,2025-09-24,30+ days ago,"Machine learning, Jira, AWS, Cross-functional collaboration, React Native, HTML, Creating UX mockups, Consulting experience, Technical solutions implementation, Model deployment, Open source contribution, Mobile application development, Prototypes, Cross-functional communication, Prototype creation, Web applications, Cloud infrastructure implementation, Mobile product development, MongoDB, Version control, Communication skills, Scalability, CSS, Docker, DynamoDB, Jenkins, Python, AI, Developing and maintaining backend systems, Product development projects, Terraform, GitHub Actions, Figma, Scalable systems, Infrastructure as Code (IaC), PostgreSQL, MySQL","Prototyping – Ability to create both Low-Fidelity (LoFi) and High-Fidelity (HiFi) wireframes, building interactive prototypes for user testing, developer…",https://www.indeed.com/viewjob?jk=f3fdec263b1faf11
54234ac00afd4fb8,Full Stack Developer,NPT2,0.0,0,Remote,True,N/A,,,,2025-11-25,30+ days ago,"Continuous Delivery (CD) implementation, Azure, AWS, Git, Google Cloud Platform, Consulting firm experience, Software architecture, UI development, NoSQL, Web applications, Version control, Communication skills, Docker, Mentoring, Vue.js, Python, SQL, Developing and maintaining backend systems, Java, Node.js",Employment Type: Full-time (W2 through North Point Technology).  We're supporting a major consulting organization that needs a senior-level full-stack engineer…,https://www.indeed.com/viewjob?jk=54234ac00afd4fb8
5fa6b2da3b6e4fcc,Full Stack Software Engineer 5 - Game Developer Tools,Netflix,3.9,838,Remote,True,388000 - 558000 (YEARLY),388000.0,558000.0,,2025-12-10,30+ days ago,"Java, GraphQL, Unreal Engine, Node.js, Implementing APIs, UI development, Data modeling projects, UX design, Host/hostess experience, TypeScript, Unity, Python, Game development, Debugging, UI design, JavaScript frameworks, Developing and maintaining backend systems, Data model design","You thrive on developer experience and game development workflows, working closely with game developers to shape product direction and owning features end to…",https://www.indeed.com/viewjob?jk=5fa6b2da3b6e4fcc
3c320fbf0346fe51,Senior Machine Learning Engineer - Payments,Plaid,4.3,12,"New York, NY",True,225600 - 337200 (YEARLY),225600.0,337200.0,,2026-01-22,3 days ago,"Spark implementation, Distributed computing, Engineering, Spark, Model deployment, Mathematics, Jupyter, Natural language processing, Model training, Outlier detection, Computer science, Scalability, Master's degree, Data analytics, AI, Computer Science, Developing and maintaining backend systems, Implementing machine learning algorithms, Scalable systems, Data-driven decision making, Jupyter Notebook",We're looking for machine learning engineers with experience applying state-of-the-art machine learning and modeling techniques - including natural language…,https://www.indeed.com/viewjob?jk=3c320fbf0346fe51
e9fb501b363098e6,Jr. Cloud Application Developer,Accenture Federal Services,3.7,138,"Washington, DC",True,69200 - 124200 (YEARLY),69200.0,124200.0,,2026-01-21,4 days ago,"Containerization, RDS database, Decision making, Application design, Amazon EKS, NoSQL, AWS Lambda, Scalability, C, Implementing APIs, Implementing cloud migration projects, Python, Automation, Serverless cloud services, AI, S3, SQL, Developing and maintaining backend systems, Java, Scalable systems, Technical troubleshooting support, Generative AI","Hands-on Development, Troubleshooting and decision-making in the use of technologies such as Python, SQL, containers and AWS services like Lambda, RDS, API…",https://www.indeed.com/viewjob?jk=e9fb501b363098e6
1ba0d12102ce1b67,Full Stack Developer,P2 Systems,0.0,0,Remote,True,N/A,,,Contract,2021-03-17,30+ days ago,"Scalability, Analysis skills, Java, Analytics, ETL, AWS, Scalable systems, Full-stack development, Python, Cloud services, PostgreSQL, JavaScript frameworks","CONTRACT DURATION: Contract (9 months – yr) to hire.  Development skills with Java, Angular, Python, or other applicable languages.",https://www.indeed.com/viewjob?jk=1ba0d12102ce1b67
cc7f2a93c4019ccd,"Forward Deployed Engineer, Python",Socket,0.0,0,"San Francisco, CA",True,125000 - 200000 (YEARLY),125000.0,200000.0,,2025-11-25,30+ days ago,"Continuous Delivery (CD) implementation, Software documentation, Security assessment, Consulting experience, Client relationship development, Technical solutions implementation, Stakeholder management, Training delivery, Analysis skills, Customer relationship building, Communication skills, Implementing APIs, Workshop facilitation, Python, Automation, Vulnerability management, Software coding, Technical writing, Stakeholder relationship building, Customer communication, Project stakeholder communication","Socket helps devs and security teams ship faster by cutting out security busywork.  Thousands of orgs use Socket to safely find, audit, and manage open source…",https://www.indeed.com/viewjob?jk=cc7f2a93c4019ccd
6d8cb2de3d052fbb,Staff Python Software Engineer,Alteryx,3.7,50,Remote,True,183000 - 212000 (YEARLY),183000.0,212000.0,,2025-10-22,30+ days ago,"Azure, AWS, Cross-functional collaboration, Continuous integration, Microservices, Google Cloud Platform, Open source contribution, ETL, Cross-functional communication, Performance tuning, Communication skills, Scalability, Docker, Analytics, Data modeling, Implementing APIs, Mentoring, Python, Debugging, Developing and maintaining backend systems, Clean architecture, System design, Scalable systems, C++, Design patterns",Open-source contributions or a track record of improving developer tooling.  Experience Level: 10+ years professional software engineering experience.,https://www.indeed.com/viewjob?jk=6d8cb2de3d052fbb
a0b33c157a76a2d3,Mid-Level Developer (Java/Backend),ActioNet,3.7,183,Remote,True,N/A,,,,2026-01-23,2 days ago,"Organizational skills, Automating deployment processes, Data structures, Kanban, Unit testing, HDI Certification, Jira, AWS CloudFormation, Cross-functional collaboration, Microservices, RDS database, Systems & applications support, Integration testing, Tomcat, Training & development, Algorithms, Patch management, Application design, IT, System architecture design, Improving operational efficiency, Cross-functional communication, AWS Lambda, Version control, Computer science, Communication skills, Implementing web services, Data Integration (Data management), Scalability, Docker, System performance monitoring, Analysis (software development lifecycle), Presentation skills, IT system monitoring, Spring Boot, Bachelor's degree, Python, Vue.js, Cloud Native Design, System maintenance, Computer Science, S3, Developing and maintaining backend systems, TypeScript, Elasticsearch, Terraform, Amazon EC2, GitLab, Agile software development, System design, SAFe, Confluence, Scalable systems, Training, Data Architecture Design (Architecture design skills), ISO 20000, Product backlog management, Bitbucket","3+ years of experience as a software engineer, backend developer.  IgniteAction is seeking an experienced API Developer to join our team and contribute to the…",https://www.indeed.com/viewjob?jk=a0b33c157a76a2d3
de616d253e6f88ba,AI Developer,Harvard Business Publishing,3.5,13,Remote,True,150000 - 170000 (YEARLY),150000.0,170000.0,,2026-01-23,2 days ago,"Dashboard development, Continuous Delivery (CD) implementation, Azure, Cross-functional collaboration, Git, Machine learning libraries, PyTorch, Model deployment, Stakeholder management, Pandas, Snowflake, Amazon SageMaker, Machine learning frameworks, Prototypes, Model training, Data quality management, Cross-functional communication, Communication skills, Docker, MLOps, Implementing APIs, Data analytics, Flask, Software deployment, AI, Data transformation pipeline development, SQL, Statistics, Cloud data warehouses, New product development, Stakeholder relationship building, Stakeholder engagement, Prototype creation",The AI Developer (AID) at Harvard Business Publishing (HBP) will play a pivotal role in driving innovation and enhancing the company's product offerings through…,https://www.indeed.com/viewjob?jk=de616d253e6f88ba
