Job_Key,Title,Company,Rating,Review_Count,Location,Is_Remote,Salary_Text,Salary_Min,Salary_Max,Job_Type,Date_Posted,Date_Created,Skills_Detected,Summary,Link
73001ad831292ee7,Staff Data Engineer,NBCUniversal,4.0,3339,"New York, NY 10112",True,130000 - 170000 (YEARLY),130000.0,170000.0,,2025-12-09,30+ days ago,"Spark implementation, Information Systems, Organizational skills, Distributed computing, Data Science, Azure, AWS, Cross-functional collaboration, Software documentation, Feature extraction, Spark, Model deployment, Data model design, Snowflake, Model training, Requirements analysis, Cross-functional communication, Business requirements, Developing automated testing protocols, Application deployment, Communication skills, Team management, Data Integration (Data management), Scalability, Team development, Data modeling, Implementing APIs, Data analytics, Implementing cloud migration projects, Leadership, Bachelor's degree, Python, Cloud Native Design, AI, Computer Science, SQL, Statistics, Implementing machine learning algorithms, Agile software development, Cloud data warehouses, Cloud development, Scalable systems, Data Architecture Design (Architecture design skills), Design patterns, Apache Hive, Generative AI",Create documentation for developers and business users to help them understand our products.  We are seeking a Staff Data Engineer looking to build the next…,https://www.indeed.com/viewjob?jk=73001ad831292ee7
6f83a45f2f18d180,Senior Software Engineer (Remote),WCG,3.0,26,"Cary, NC",True,87840 - 136500 (YEARLY),87840.0,136500.0,,2026-01-20,5 days ago,".NET Core, Data normalization, Customer support ticket management, Microservices, Root cause analysis, Software documentation, C#, T-SQL, System architecture design, Application deployment, Team management, Implementing web services, Team development, Visual Studio, Django, Mentoring, SQL databases, Process improvement, Bachelor's degree, Flask, Computer Science, Information Science, Java, Agile software development, System design, Microsoft SQL Server, Technical writing, Technical troubleshooting support, PostgreSQL, Escalation handling",Mentor other software developers on best practices and provide peer review of code changes.  WCG is proud to serve individuals on the frontlines of science and…,https://www.indeed.com/viewjob?jk=6f83a45f2f18d180
d747b7f6f075fbc6,Sr/Staff Infrastructure Software Engineer (Remote - US),BNSF Railway,3.1,1923,Remote,True,165000 - 300000 (YEARLY),165000.0,300000.0,,2025-10-30,30+ days ago,"Prometheus, Containerization, Continuous Delivery (CD) implementation, AWS, Identity and access management (IAM) solutions, Grafana, Data Center Operations, OpenStack, Version control, Computer science, Communication skills, Scalability, Go, Implementing APIs, Mentoring, Linux, React, Bachelor's degree, Python, Cloud Native Design, Computer Science, Developing and maintaining backend systems, SQL, Data center experience, Identity & access management, Java, Express.js, System design, Scalable systems, Graph databases, GitHub, DigitalOcean, Data storage",Interest in open-source infrastructure and developer platforms.  Github commits to open-source infrastructure and developer platforms projects.,https://www.indeed.com/viewjob?jk=d747b7f6f075fbc6
f6ff2fa9c1a28a14,US Tech - Backend Developer,PRICE WATERHOUSE COOPERS,3.9,10222,Remote,True,55000 - 187000 (YEARLY),55000.0,187000.0,,2026-01-22,2 days ago,"Statistical modeling, Cross-functional collaboration, Decision making, Data transformation, Client relationship development, Model deployment, Machine learning/AI-based analysis, Data visualization projects, UI development, Customer relationship building, Cross-functional communication, Scalability, Predictive analytics, Team development, Data visualization, MLOps, Mentoring, Bachelor's degree, Python, AI, Developing and maintaining backend systems, Statistics, Data-driven decision making, Generative AI","At PwC, our people in data and analytics engineering focus on leveraging advanced technologies and techniques to design and develop robust data solutions for…",https://www.indeed.com/viewjob?jk=f6ff2fa9c1a28a14
1f0dbcbcb91dd9c4,US Tech - Backend Developer Manager,PRICE WATERHOUSE COOPERS,3.9,10222,Remote,True,73500 - 244000 (YEARLY),73500.0,244000.0,,2026-01-22,2 days ago,"Statistical modeling, Project implementation, Identifying new business opportunities, Conflict management, Technical solutions implementation, Model deployment, Stakeholder management, Machine learning/AI-based analysis, UI, Data visualization projects, Budget planning, Scalability, Predictive analytics, Team development, Data visualization, Mentoring, Project leadership, Bachelor's degree, Python, Cloud Native Design, AI, Developing and maintaining backend systems, Statistics, Team motivation (leadership skill), Performance management, Scalable systems, Data-driven decision making, Client services experience within consulting industry, Leadership, Escalation handling","At PwC, our people in data and analytics engineering focus on leveraging advanced technologies and techniques to design and develop robust data solutions for…",https://www.indeed.com/viewjob?jk=1f0dbcbcb91dd9c4
0c1397172ad61c28,Machine Learning Tech Lead,Crowe LLP,3.6,308,"Miami, FL 33131",True,126500 - 299500 (YEARLY),126500.0,299500.0,,2026-01-07,18 days ago,"Automating deployment processes, Kanban, Unit testing, Model evaluation, Continuous Delivery (CD) implementation, Azure, AWS, Git, Machine learning libraries, Decision making, Software documentation, PyTorch, Project timeline management, ERP systems, Google Cloud Platform, Technical solutions implementation, Model deployment, Prompt engineering, Stakeholder management, Application Integration, Training & development, Machine learning frameworks, Model training, Engineering testing, Business requirements, Application deployment, Communication skills, Team management, Scalability, Team development, Docker, Test Planning (Quality assurance practices), MLOps, Mentoring, Research & development, SDKs, Project stakeholder communication, AI, Career guidance, Product development projects, Agile software development, UNIX, TensorFlow, Scalable systems, Technical writing, Solution architecture design, Prototype creation, Project leadership, Leadership, Generative AI","AI-Assisted Software Engineering: Demonstrated ability to embrace and advocate for AI-assisted software engineering practices, including the effective use of…",https://www.indeed.com/viewjob?jk=0c1397172ad61c28
3a1aa39f5e2717ea,"Full Stack Software Engineer III, Infrastructure (Remote)",CrowdStrike,3.8,54,Remote,True,120000 - 180000 (YEARLY),120000.0,180000.0,,2025-07-22,30+ days ago,"Prometheus, Continuous Delivery (CD) implementation, AWS CloudFormation, Cross-functional collaboration, Microservices, Analysis skills, Grafana, gRPC, UI development, Cross-functional communication, Web applications, Communication skills, Implementing web services, Distributed systems, Go, Linux, Python, Cloud Native Design, JavaScript frameworks, Developing and maintaining backend systems, TypeScript, Terraform, Kubernetes, Infrastructure as Code (IaC), Technical troubleshooting support","Participate in code reviews and provide constructive feedback to other developers.  We're a small, remote-first team of full stack engineers building APIs and…",https://www.indeed.com/viewjob?jk=3a1aa39f5e2717ea
9e477225e80130e6,Software Development Engineer,Zoom,3.8,47,"San Jose, CA",True,142000 - 186000 (YEARLY),142000.0,186000.0,,2025-11-14,30+ days ago,"OAuth 2.0, Algorithms, Django, Master's degree, Express.js, Ruby on Rails, Computer Engineering, SDKs, Electrical Engineering, Vue.js, Research, Computer Science, Developing and maintaining backend systems","Develop Built by Zoom Apps and SDK including research and build new features by coding, fixing bugs and issues, enabling developer partners by solving complex…",https://www.indeed.com/viewjob?jk=9e477225e80130e6
0ce5b557cf8105c9,Software Engineer,"Apprio, Inc.",0.0,0,Remote,True,N/A,,,,2026-01-06,19 days ago,"Software documentation, PyTorch, Engineering, Systems & applications support, Consulting experience, Mathematics, C#, Azure DevOps proficiency, Requirements specification, Application design, Machine learning frameworks, System architecture design, Report writing, Test Planning (Quality assurance practices), Master's degree, Analysis (software development lifecycle), Bachelor's degree, Vue.js, System maintenance, AI, Computer Science, Keras, SQL, System design, Scope management, Software coding, Electrical Engineering, Database software proficiency, Physics","Provides internal consulting, technical guidance, information, and support to other application developers, computer operations, workstation support, company…",https://www.indeed.com/viewjob?jk=0ce5b557cf8105c9
2eba28374860017f,Software Engineer,Mechanical Orchard,0.0,0,Remote,True,N/A,,,,2025-10-23,30+ days ago,"Continuous Delivery (CD) implementation, Cross-functional collaboration, Full-stack development, Systems & applications support, Elixir, COBOL, Rust (programming language), Cross-functional communication, Communication skills, Test-driven development, Employee onboarding, Pair programming, Go, Mentoring, Python, System maintenance, AI, Java, Agile software development, Office experience, UNIX, Mainframe, DevSecOps Practices","Help onboard developers (internal and external) to practices and techniques.  They are comfortable as a full stack developer, and have expertise in at least one…",https://www.indeed.com/viewjob?jk=2eba28374860017f
6199c9fab12d1da3,Machine Learning Infrastructure Engineers,Shopify,3.3,319,Remote,True,N/A,,,,2025-10-31,30+ days ago,"Spark implementation, Distributed computing, Prometheus, Containerization, Continuous Delivery (CD) implementation, Azure, AWS, Batch data processing, Spark, Google Cloud Platform, Model deployment, Grafana, Machine learning frameworks, gRPC, Performance tuning, Kafka, MLOps, Go, Implementing APIs, A/B testing, Redis, SDKs, Python, AI, Real-time data processing implementation, Terraform, Java, System design, TensorFlow, Scalable systems, Quantization, Infrastructure as Code (IaC), Data storage, MySQL","Proficient in Python/Go/Java; experience building developer tooling and self-service platforms.  They design high-performance, GPU-accelerated systems on…",https://www.indeed.com/viewjob?jk=6199c9fab12d1da3
c66f85bec6a9af41,Principal Software Engineer (Remote) - 24061,Huntington Ingalls Industries Inc.,3.7,2762,Remote,True,143507 - 245000 (YEARLY),143507.0,245000.0,,2025-07-24,30+ days ago,"Automating deployment processes, Project management lifecycle, Prometheus, Containerization, Continuous Delivery (CD) implementation, Azure, Identity and access management (IAM) solutions, Google Cloud Platform, Technical solutions implementation, Open source contribution, System architecture design, Communication skills, Implementing web services, Scalability, Master's degree, Go, SQL databases, Bachelor's degree, Python, Debugging, Data transformation pipeline development, S3, Developing and maintaining backend systems, SQL, Amazon EC2, Identity & access management, Java, System design, Scalable systems, Big data, Technical troubleshooting support, High school diploma or GED, PostgreSQL","100% paid employee premium for healthcare, vision and dental plans.  Generous PTO + 10 paid holidays.  We build and operate critical backend systems that manage…",https://www.indeed.com/viewjob?jk=c66f85bec6a9af41
155d1dfff8b6b8ff,Software Engineer,Stargazr UG,0.0,0,Remote,True,N/A,,,,2024-03-25,30+ days ago,"SQL, Analysis skills, SaaS, Math, Debian, English, Data transformation, Pandas, Flask, Database software proficiency, Computer Science, Computer science, Developing and maintaining backend systems","You'll write efficient, reusable, and reliable code, while also supporting our front-end team when needed.  BSc or MSc in Computer Science or equivalent.",https://www.indeed.com/viewjob?jk=155d1dfff8b6b8ff
f5575de550592e5d,Software Developer/Engineer (DoD Skillbridge),Pitch Aeronautics Inc.,0.0,0,Remote,True,N/A,,,,2024-01-23,30+ days ago,"Azure, AWS, Cross-functional collaboration, Information security compliance, Cloud services, UI development, System architecture design, Web applications, UI design, Data Integration (Data management), Scalability, Docker, Master's degree, Information security, Bachelor's degree, Python, Vue.js, Computer Science, Software Engineering, Algorithm design, DoD 8570, Internet of Things, Java, NIST standards, CISSP, Scalable systems, Front-end development, C++, CompTIA Security+","We're looking for a software developer who can develop and maintain our software platform, providing utility customers a tool to visualize relevant operational,…",https://www.indeed.com/viewjob?jk=f5575de550592e5d
3f95bf37cbfd2aca,Actimize Developer,CEDENT,0.0,0,Remote,True,40 - 60 (HOURLY),40.0,60.0,Contract,2024-01-17,30+ days ago,"Software development, NICE Actimize, UI, Dashboard development, Dart, AWS, PL/SQL, Python, Bank experience, J2EE, Anti-Money Laundering (AML) compliance (compliance procedures implemented), Software implementation, KYC",This role will help with implementations of STAR module and Actimize Watch - plan to be implemented this year and are in initial design phase; will start…,https://www.indeed.com/viewjob?jk=3f95bf37cbfd2aca
a533505518ecc191,Application Developer - Information Technology - Dallas,Winstead,3.4,27,"Dallas, TX",True,N/A,,,,2025-12-26,30 days ago,"OAuth 2.0, Unit testing, Sketch, Machine learning, HTML, Systems & applications support, Cloud services, C#, ChatGPT, Law office, Application design, Productivity software, Responsive design, Business requirements, Visual Studio Code, NPM, Version control, Application deployment, Communication skills, Visual Studio, Data Integration (Data management), Scalability, CSS, GraphQL, SSO, Database management, Authentication, Python, Vue.js, AI, Legal firm experience, SQL, TypeScript, Figma, Node.js, Scalable systems, GitHub, Database software proficiency, Azure Data Factory",The ideal candidate will play a key role in developing and integrating applications that enhance our firm's legal services and internal operations.,https://www.indeed.com/viewjob?jk=a533505518ecc191
639c3a7777ecf4f2,Software Engineer (L3),Twilio,3.7,61,Remote,True,138700 - 203900 (YEARLY),138700.0,203900.0,,2025-10-28,11 days ago,"Spark implementation, Cloud-based systems, Big data systems, Distributed computing, Cross-functional collaboration, Data analysis skills, Engineering, Spark, Analysis skills, Data quality management, AWS Glue, Cross-functional communication, Business requirements, Kafka, Communication skills, Scalability, Master's degree, Mentoring, Bachelor's degree, Python, Computer Science, Java, System design, Scalable systems, Data Architecture Design (Architecture design skills), Solution architecture design, Scala, Design patterns, Apache Hive","You will work closely with cross-functional teams to understand business requirements, architect scalable solutions, and implement data solutions and…",https://www.indeed.com/viewjob?jk=639c3a7777ecf4f2
e23442fb843a89f7,Full Stack Software Developer,SAS,4.0,269,"Cary, NC 27513",True,N/A,,,,2025-12-22,30+ days ago,"Cloud-based systems, Azure, Full-stack development, Technical solutions implementation, Model deployment, Open source contribution, Software quality assurance, Performance testing, Functional testing, Application deployment, Computer science, Scalability, Security policy implementation, Docker, Go, Implementing APIs, Research & development, Linux, Bachelor's degree, Python, Computer Science, Software implementation, GitHub Actions, Agile software development, Scalable systems, Database software proficiency","Collaborate with other developers to implement effective solutions.  Ensure quality through functional, unit, and performance testing; work closely with model/…",https://www.indeed.com/viewjob?jk=e23442fb843a89f7
19c49d70b916ae3c,Cloud Engineer (AWS/CDK/Object Oriented Programming),Mutual of Omaha,3.7,966,Remote,True,110000 - 145000 (YEARLY),110000.0,145000.0,,2025-12-17,30+ days ago,"Automating deployment processes, Agile, AWS, APIs, Load balancers, Cloud networking, Research, Requirements gathering, Network security implementation, Cloud security engineering, Scalability, Cloud monitoring, IT system monitoring, Python, Software deployment, Debugging, Cloud Architecture Design (Architecture design skills), TypeScript, Scalable systems, Infrastructure as Code (IaC), VPN management","Partner with teams across the organization to uncover challenges, accelerate delivery, and make the developer experience seamless through modern self-service…",https://www.indeed.com/viewjob?jk=19c49d70b916ae3c
c255fd9610f79f31,"Senior Software Development Engineer, Big Data",Zillow,3.8,295,Remote,True,152900 - 257100 (YEARLY),152900.0,257100.0,,2025-12-04,30+ days ago,"Databricks, Automating deployment processes, Cloud-based systems, Cross-functional collaboration, Batch data processing, Root cause analysis, Spark, Forecasting, Model deployment, Analysis skills, Safe work practices, Model training, Amazon EKS, Improving operational efficiency, Cross-functional communication, Communication skills, Scalability, Process improvement, Python, Software deployment, AI, Real-time data processing implementation, Implementing machine learning algorithms, Kubernetes, GitLab, Agile software development, Scalable systems, Stakeholder engagement, PostgreSQL","The Zillow Group’s Housing Trends Data Engineering team brings innovative analysis, creativity, and excellence to the U.S. housing market.",https://www.indeed.com/viewjob?jk=c255fd9610f79f31
5d2e1bc0d06e8e5c,Power System Simulation Software Developer,PowerGEM,0.0,0,Remote,True,N/A,,,,2025-05-05,30+ days ago,"Unit testing, Software documentation, Engineering, Consulting experience, Power systems analysis, Integration testing, C#, Software training, Application design, Simulation systems, Electrical engineering, Engineering testing, Communication skills, PSS/E, Scalability, C, Marketing, Master's degree, Research & development, Bachelor's degree, Python, Debugging, Software implementation, Software support, Electrical Engineering, Bug Reporting (Quality assurance practices)","Support transmission owners, generation developers, and ISOs with TARA usage and TARA-based studies.  Be proactive, open and adaptable to evolving technological,…",https://www.indeed.com/viewjob?jk=5d2e1bc0d06e8e5c
f621f586f82938c2,Full Stack Software Engineer,Lawrence Berkeley National Laboratory,4.2,210,"San Francisco Bay Area, CA",True,139440 - 267996 (YEARLY),139440.0,267996.0,,2026-01-16,9 days ago,"Distributed computing, Project management, Decision making, Full-stack development, Google Cloud Platform, Data model design, Application design, Machine learning/AI-based analysis, Grafana, Web applications, Kafka, Computer science, Team management, Scalability, Master's degree, Data modeling, Go, Mentoring, Product lifecycle management, D3.js, React, Bachelor's degree, Python, Cloud Native Design, AI, Computer Science, Elasticsearch, Kubernetes, Java, System design, UNIX, Scalable systems, Solution architecture design, Bash, PostgreSQL, Leadership, Swagger","In this role, developers create and operate robust, mission-critical solutions that collect, process, store, and present network measurements and event data…",https://www.indeed.com/viewjob?jk=f621f586f82938c2
74bcdecb4f354b59,Senior Full Stack Engineer,HumanSignal,0.0,0,Remote,True,140000 - 200000 (YEARLY),140000.0,200000.0,,2025-11-10,30+ days ago,"Spark implementation, PostgreSQL, BigQuery, SaaS, AWS, Spark, Data model design, Open source contribution, Prototypes, Performance tuning, Responsive design, Kafka, Communication skills, Django, GraphQL, Data modeling, Implementing APIs, Mentoring, Jest, Redis, JavaScript frameworks, Developing and maintaining backend systems, SQL, TypeScript, Kubernetes, Web accessibility, Scope management, Prototype creation","Engage with our open-source community (issues, discussions) to understand real-world needs and improve developer experience.",https://www.indeed.com/viewjob?jk=74bcdecb4f354b59
974389362c2baa82,Machine Learning Engineer,Quantiphi,3.4,58,Remote,True,N/A,,,,2025-10-30,30+ days ago,"Model evaluation, BigQuery, Data Science, Cross-functional collaboration, Machine learning libraries, PyTorch, Model deployment, Analysis skills, Machine learning frameworks, Model training, Cross-functional communication, Cloud storage services, Application deployment, Data preprocessing, Communication skills, Version control, Scalability, MLOps, Master's degree, Implementing APIs, Developing data pipelines, Bachelor's degree, Debugging, AI, Computer Science, TensorFlow, Scalable systems, Technical troubleshooting support, GitHub, Data storage, Generative AI",Our signature approach combines groundbreaking machine-learning research with disciplined cloud and data-engineering practices to create breakthrough impact at…,https://www.indeed.com/viewjob?jk=974389362c2baa82
02635f9cb7d754dd,Senior Power Platform Developer CCV,Cotiviti,3.3,647,Remote,True,110000 - 135000 (YEARLY),110000.0,135000.0,,2025-03-28,30+ days ago,"Organizational skills, Cloud-based systems, Azure, AWS, Cross-functional collaboration, Root cause analysis, Angular, Analysis skills, Application design, Software testing, Cross-functional communication, Computer science, Requirements gathering, Communication skills, Analysis (software development lifecycle), Bachelor's degree, Python, AI, Computer Science, Agile software development, Microsoft Power Automate, Technical skills instruction, Solution architecture design, Technical troubleshooting support","Provide class instruction to new developers, as needed.  Provide expert knowledge to coach and/or aid other Power Platform developers.",https://www.indeed.com/viewjob?jk=02635f9cb7d754dd
df981a23b026eda9,Staff Machine Learning Engineer - Fraud Data,Plaid,4.3,12,"Seattle, WA",True,192000 - 400000 (YEARLY),192000.0,400000.0,,2025-10-16,30+ days ago,"Spark implementation, Scalability, Amazon SageMaker, Financial fraud detection, Cross-functional collaboration, Machine learning frameworks, Mentoring, Model training, Scalable systems, System architecture design, PyTorch, IT system monitoring, Spark, Software deployment, Model deployment, Infrastructure architecture",We ensure that our systems scale reliably and efficiently as Plaid continues to grow and support hundreds of customers.,https://www.indeed.com/viewjob?jk=df981a23b026eda9
bdfe9ad7044cda13,Software Engineer - Frontend (Experienced; Remote),Dagster Labs,0.0,0,"San Francisco, CA",True,190000 - 230000 (YEARLY),190000.0,230000.0,,2025-09-11,30+ days ago,"Software architecture, GraphQL, UX design, UI development, Full-stack development, Python, macOS, JavaScript frameworks, Communication skills, TypeScript","Are you a frontend-focused software engineer with a passion for intuitive product experiences, dev tooling, and data?  Fluent in JavaScript and React.",https://www.indeed.com/viewjob?jk=bdfe9ad7044cda13
b12cab716358a006,Backend Software Developer Job Code IND_280524_4,NST Cyber,0.0,0,Remote,True,N/A,,,,2024-05-28,30+ days ago,"OAuth 2.0, Cross-functional collaboration, Microservices, Cross-functional communication, MongoDB, Communication skills, Scalability, Docker, Bachelor's degree, Authentication, Python, Computer Science, JavaScript frameworks, Developing and maintaining backend systems, Software Engineering, Scalable systems, Front-end development, Technical troubleshooting support, Data storage, Design patterns",Collaborate with frontend developers to integrate backend functionality into web applications.  Collaborate with the development team to understand project…,https://www.indeed.com/viewjob?jk=b12cab716358a006
4bbce902cce443d6,Senior Backend Software Engineer,The Zebra,3.3,19,"Austin, TX",True,145000 - 180000 (YEARLY),145000.0,180000.0,,2025-11-05,30+ days ago,"Cloud-based systems, AWS, Microservices, SEO, Ruby, Relational databases, C#, Prototypes, NoSQL, Web applications, Computer science, Communication skills, Experience in startups, Scalability, Team development, Django, Go, Mentoring, A/B testing, Computer Science, Web design, JavaScript frameworks, Developing and maintaining backend systems, Java, Node.js, Scalable systems, C++, New product development, Branding, Prototype creation, Continuous improvement","Eager to take ownership of work, including collaboration with collaborators and developers through the product development lifecycle.",https://www.indeed.com/viewjob?jk=4bbce902cce443d6
2495378c3676a00c,"Member of Technical Staff, Backend Engineer, API",Runway AI,0.0,0,Remote,True,240000 - 290000 (YEARLY),240000.0,290000.0,,2022-06-01,30+ days ago,"PostgreSQL, Prometheus, Containerization, Azure, Software documentation, PyTorch, Google Cloud Platform, Prompt engineering, Managing IT infrastructure, Fraud prevention and detection, Grafana, Prototypes, AWS Lambda, System performance monitoring, Scalability, Implementing APIs, IT system monitoring, SDKs, Authentication, S3, Developing and maintaining backend systems, TypeScript, Terraform, Amazon ECS, Incident response, Scalable systems, Improving database performance, Prototype creation","Improve the public API developer experience with better documentation, SDKs, and tooling.  You'll work on the critical infrastructure that powers both our public…",https://www.indeed.com/viewjob?jk=2495378c3676a00c
