Job_Key,Title,Company,Rating,Review_Count,Location,Is_Remote,Salary_Text,Salary_Min,Salary_Max,Job_Type,Date_Posted,Date_Created,Skills_Detected,Summary,Link
3db002e870940c14,Android Developer- Mobile,Blink - The Employee App,0.0,0,Remote,True,N/A,,,,2026-01-12,26 days ago,"Unit testing, Debugging, Kotlin, Application Integration, Mobile application development, Workday, Android, Databases, Mobile product development, Continuous Delivery (CD) implementation, Responsive design, Integration testing","This squad is fully remote, and works closely with our US customers and partners.  As part of this squad, you’ll work with a high degree of ownership, delivering…",https://www.indeed.com/viewjob?jk=3db002e870940c14,Android Developer,Remote
1bbd0c1ee24215d9,Android Developer(Frontend Engiineer),Rapsys Technologies,0.0,0,Remote,True,67518.89 - 81313.07 (yearly),67518.89,81313.07,Contract,2025-10-23,30+ days ago,"Gradle, Git, Selenium, Kotlin, Analysis skills, Android, SonarQube, Scalability, Scalable systems, Cross-functional communication, iOS application development, Jenkins, JUnit, Agile software development, Data encryption, React Native, Android Studio, Swift, Xcode, Mobile product development, Software documentation, Microservices, Unit testing, Cross-functional collaboration, UI, Version control","You will be responsible for designing, developing, and maintaining high-performance Android applications with a focus on user experience, scalability, and…",https://www.indeed.com/viewjob?jk=1bbd0c1ee24215d9,Android Developer,Remote
95af18e70fdbb971,Android Developer,Odixcity Consulting,0.0,0,Remote,True,400000 - 600000 (yearly),400000.0,600000.0,,2026-01-15,22 days ago,"Computer Science, Application deployment, Engineering, Bachelor's degree, Android, Requirements gathering, System maintenance, Mobile design, Scalability, Scalable systems, JSON, Mobile application development, Cross-functional communication, XML, Software testing, RESTful API, Mobile product development, Software documentation, Cross-functional collaboration, UI design",Min Qualification: Degree Experience Level: Entry level Experience Length: 2 years.  Build scalable and user-friendly Android applications from concept through…,https://www.indeed.com/viewjob?jk=95af18e70fdbb971,Android Developer,Remote
e79d3ff6f99e0c12,"Software Engineer II, Android",Omada Health,3.5,30,Remote,True,140800 - 184000 (yearly),140800.0,184000.0,,2025-09-19,30+ days ago,"Application deployment, Kotlin, Android, CircleCI, Scalability, S3, Mentoring, Scalable systems, Communication skills, Mobile application development, Cross-functional communication, Project leadership, AI, Agile software development, JUnit, Docker, Research, Product development projects, PostgreSQL, RDS database, Mobile product development, GraphQL, Multithreading, Ruby on Rails, GitLab, Unit testing, Software architecture, Cross-functional collaboration, React","Our software engineers are comfortable dealing with high-level specifications, working independently and in small teams, and are heavy contributors in the…",https://www.indeed.com/viewjob?jk=e79d3ff6f99e0c12,Android Developer,Remote
e4b4e365c130a2e6,Sr Android Developer (160k) - 100% Remote Work,TWO95 International INC,0.0,0,"Dallas, TX",True,N/A,,,,2025-09-30,30+ days ago,"MVC, Agile software development, JSON, Data structures, Algorithms, Debugging, Unit testing, Kotlin, Mobile application development, RESTful API, XML, Android, Mobile product development, Technical troubleshooting support, Integration testing, GitHub, Version control, Design patterns","Participates in peer code reviews and contributes effectively within an agile setup with designers, product managers, and peer developers.",https://www.indeed.com/viewjob?jk=e4b4e365c130a2e6,Android Developer,Remote
271fb3375435313b,Lead Android Developer - USA (Remote),Photon,4.0,262,Texas,True,52000 - 182000 (yearly),52000.0,182000.0,,2025-08-21,30+ days ago,"Performance tuning, JUnit, JSON, Unit testing, Jira, Git, Communication skills, Mockito, Kotlin, Mobile application development, New Relic, Postman (API platform), Android, Firebase, SQLite, Continuous Delivery (CD) implementation, Rally (agile software)","Compose Experience working with Jetpack Components(Compose, Architecture Components, Navigation &amp; etc.).  Kotlin Expert level Android development using Java(5+…",https://www.indeed.com/viewjob?jk=271fb3375435313b,Android Developer,Remote
4a01c33551dd2023,Software Developer — Android - US,TextNow,3.8,6,Remote,True,123900 - 298800 (yearly),123900.0,298800.0,,2025-11-15,21 days ago,"Kotlin, Android, APIs, Scalability, iOS, Developing and maintaining backend systems, Mentoring, Scalable systems, System architecture design, iOS application development, System design, AI, Automating deployment processes, Mobile product development, Team development, Performance tuning, Unit testing, A/B testing, Continuous Delivery (CD) implementation, UI, Data analytics","Drive technical discussions, mentor developers, and influence strategic direction across mobile platforms.  Dogfooding helps us experience what customers do, to…",https://www.indeed.com/viewjob?jk=4a01c33551dd2023,Android Developer,Remote
0a5ad03bc129d350,Software Development Engineer in Test 4 - Account & Security Experiences,Netflix,4.0,840,Remote,True,200000 - 300000 (yearly),200000.0,300000.0,,2026-02-03,3 days ago,"Android development, Android, Business requirements, Scalability, iOS, JavaScript, Cross-functional communication, iOS development, Distributed systems, Host/hostess experience, Cross-functional collaboration, Engineering testing, Microservices, Automation, A/B testing, Test Planning (Quality assurance practices), Java, Developing automated testing protocols, UI","We develop A/B tests and features for web, TV, and mobile platforms to introduce Netflix to more people, encourage sign-ups, and keep members engaged for the…",https://www.indeed.com/viewjob?jk=0a5ad03bc129d350,Android Developer,Remote
46d9b602a73780bb,Mobile App Developer,KeyPleaz,0.0,0,Remote,True,55000 - 100000 (yearly),55000.0,100000.0,"Full-time, Contract",2026-01-28,10 days ago,"Implementing APIs, Git, Kotlin, Android, Cloud services, Requirements gathering, Scalability, Azure, iOS, Communication skills, Cross-functional communication, Mobile testing, iOS application development, UX design, Agile software development, React Native, Figma, Swift, Mobile product development, Performance tuning, Technical troubleshooting support, Cross-functional collaboration, UI design, Version control","* Collaborate with product managers, designers, and other developers to define app requirements and ensure seamless functionality.",https://www.indeed.com/viewjob?jk=46d9b602a73780bb,Android Developer,Remote
474bd4423e39ca84,iOS Engineer (Convos),XMTP Labs,0.0,0,Remote,True,225000 - 265000 (YEARLY),225000.0,265000.0,,2025-12-29,30+ days ago,"Unit testing, Software architecture, Swift, Open source contribution, APIs, Mobile product development, New product launch experience, iOS application development, Cross-functional collaboration, iOS, Project leadership, Leadership",Experience in open-source projects and collaborating with external developers.  $225-265K base pay and equity upside.  Prior involvement in open-source projects.,https://www.indeed.com/viewjob?jk=474bd4423e39ca84,iOS Developer,Remote
3038999b50c4f0e3,Mobile Developer (iOS & Android),Greektory,0.0,0,Remote,True,50000 - 76181.41 (YEARLY),50000.0,76181.41,"Full-time, Part-time, Contract",2026-01-26,11 days ago,"Git, Kotlin, Android, Firebase, Bug Tracking (Quality assurance practices), iOS API integration, iOS, Software troubleshooting, Stripe payment processing, Communication skills, Debugging, Databases, iOS application development, Realm, Android Studio, Swift, Xcode, Mobile product development, UI, Version control",Familiar with various iOS libraries and package integrations.  Comfortable using Xcode and submitting builds to the App Store.  Nice-to-Haves (Bonus Points):*.,https://www.indeed.com/viewjob?jk=3038999b50c4f0e3,iOS Developer,Remote
1c8eb20c69aa31b6,iOS Developer,Walter,4.0,20,Remote,True,N/A,,,,2025-11-21,30+ days ago,"Scalable systems, Swift, RxSwift, iOS, Mobile product development, iOS application development, Scalability, Distributed computing, System design, New product development","The client is looking for a mobile developer experienced in multiple aspects of the iOS stack, particularly with Swift.",https://www.indeed.com/viewjob?jk=1c8eb20c69aa31b6,iOS Developer,Remote
1bc86d1cc5773043,iOS Developer,Blink - The Employee App,0.0,0,Remote,True,N/A,,,,2026-01-09,28 days ago,"Unit testing, Automation, Application Integration, Swift, Workday, Databases, Cross-functional communication, Continuous Delivery (CD) implementation, Mobile product development, Responsive design, iOS application development, Cross-functional collaboration, Integration testing, iOS","Continuously improving (build) tools and developer experience; automating repetitive tasks, simplifying existing processes and documenting APIs and behaviour.",https://www.indeed.com/viewjob?jk=1bc86d1cc5773043,iOS Developer,Remote
fb33cb7818ef28b7,iOS Developer,Bright Vision Technologies,4.2,21,Remote,True,N/A,,,,2026-02-03,3 days ago,"Agile software development, JSON, Unit testing, Git, Swift, RESTful API, Firebase, Xcode, Auto Layout, Mobile product development, Continuous Delivery (CD) implementation, iOS application development, UX design, UI design, iOS","FULL-TIME ROLE WITH BRIGHT VISION.  IOS (Swift, Objective-C), Xcode, UIKit, SwiftUI, RESTful APIs, JSON, Core Data, Auto Layout, Git, CI/CD pipelines, Agile…",https://www.indeed.com/viewjob?jk=fb33cb7818ef28b7,iOS Developer,Remote
d994644f3a83caca,"iOS Mobile App Developer (Seasonal, W-2)",Webhead,4.7,3,Remote,True,36 - 38 (HOURLY),36.0,38.0,Temporary,2026-02-02,4 days ago,"AWS DevOps, iOS API integration, UIKit, iOS, JSON, Debugging, SWIFT, Cross-functional communication, iOS application development, Project Development, Software testing, RESTful API, Swift, Xcode, UI development, Mobile product development, Software documentation, Continuous integration, Teamwork, Cross-functional collaboration",Must be eligible to work in the US. .  Start within two (2) weeks of offer acceptance.  Seasonal assignment expected to run through September 2026*.,https://www.indeed.com/viewjob?jk=d994644f3a83caca,iOS Developer,Remote
7532d7d73f0fc2c2,iOS Software Engineer 5 - Member Engineering,Netflix,4.0,840,Remote,True,388000 - 558000 (YEARLY),388000.0,558000.0,,2025-10-15,30+ days ago,"Scalability, iOS, Scalable systems, Cross-functional communication, iOS application development, Host/hostess experience, Swift, Product development projects, UI development, Mobile product development, GraphQL, Prototypes, Scope management, Software documentation, Automation, Software architecture, Cross-functional collaboration, Prototype creation, Stakeholder relationship building","Our work spans rapid development of highly visible product experiences, long-term maintenance to enable future innovations, and building robust, scalable…",https://www.indeed.com/viewjob?jk=7532d7d73f0fc2c2,iOS Developer,Remote
53c7186d254c75ee,Senior iOS Engineer,NHL Team Jobs,0.0,0,Remote,True,150000 - 170000 (YEARLY),150000.0,170000.0,,2026-01-29,8 days ago,"Solution architecture design, Computer Science, Engineering, Bachelor's degree, Requirements gathering, Scalability, iOS API integration, iOS, Mentoring, Scalable systems, Debugging, Cross-functional communication, iOS application development, System design, AI, Agile software development, Software testing, Swift, Product development projects, Mobile product development, Team development, Performance tuning, Requirements analysis, Master's degree, Continuous Delivery (CD) implementation, Technical troubleshooting support, Cross-functional collaboration","In this role, you will play a key part in shaping the NHL's mobile products while leveraging AI-powered development tools to accelerate innovation and code…",https://www.indeed.com/viewjob?jk=53c7186d254c75ee,iOS Developer,Remote
953013a36ce02a91,Software Developer — iOS - US,TextNow,3.8,6,Remote,True,123900 - 298800 (YEARLY),123900.0,298800.0,,2026-01-16,21 days ago,"Solution architecture design, Implementing APIs, Scalability, iOS, Developing and maintaining backend systems, Mentoring, Scalable systems, iOS application development, System design, AI, Swift, Automating deployment processes, Mobile product development, Team development, Performance tuning, Unit testing, A/B testing, Continuous Delivery (CD) implementation, Cross-functional collaboration, UI, Data analytics","Drive technical discussions, mentor developers, and influence strategic direction across mobile platforms.  Dogfooding helps us experience what customers do, to…",https://www.indeed.com/viewjob?jk=953013a36ce02a91,iOS Developer,Remote
ef502000c5938a3d,Senior iOS Engineer,Zillow,3.8,296,Remote,True,152900 - 257100 (YEARLY),152900.0,257100.0,,2025-10-29,30+ days ago,"Safe work practices, Scalable systems, Agile software development, Computer vision, Swift, Analysis skills, Performance testing, Data-driven decision making, Continuous improvement, APIs, Cross-functional communication, Mobile product development, iOS application development, Scalability, Cross-functional collaboration, iOS, Machine learning",We are looking for an experienced iOS developer to help us build and integrate 3D experiences on iOS.  You will be responsible for solving key architectural…,https://www.indeed.com/viewjob?jk=ef502000c5938a3d,iOS Developer,Remote
07833b0eae3660ee,iOS Engineer,Chess.com,5.0,5,Remote,True,N/A,,,,2025-11-06,30+ days ago,"Swift, Developing automated testing protocols, Xcode, iOS application development, UX design, Cross-functional collaboration, iOS, Continuous integration","Improve the quality for millions of players with automated testing, modular architecture, and reliable developer experience.",https://www.indeed.com/viewjob?jk=07833b0eae3660ee,iOS Developer,Remote
e836515dd4d7c3d7,"Ad-Hoc Flutter Developer (Production Apps, iOS & Android)",Codingo Assignments Pte. Ltd.,0.0,0,Remote,True,20000 - -1 (YEARLY),20000.0,-1.0,"Part-time, Temporary, Contract",2026-02-06,1 day ago,"Gradle, Implementing web services, Node.js, Kotlin, SOAP, Visual Studio, Android, Firebase, MySQL, Scalability, User research for product design, iOS API integration, iOS, Scalable systems, JSON, Jira, iOS application development, Project management tools, UX design, GitHub, Microsoft SQL Server, AI, Agile software development, JUnit, Android Studio, XML, Swift, Automating deployment processes, Xcode, PostgreSQL, Mobile product development, Multithreading, Software documentation, MVC, SQL databases, GitLab, Unit testing, Xamarin, Continuous Delivery (CD) implementation, Technical troubleshooting support, Dart, Generative AI, Python, Version control, Visual Studio Code",Codingo is looking for experienced Flutter developers to support ad-hoc client projects that require rapid development and deployment of production-level mobile…,https://www.indeed.com/viewjob?jk=e836515dd4d7c3d7,iOS Developer,Remote
735013f6e04f5675,iOS Developer,Odixcity Consulting,0.0,0,Remote,True,400000 - 600000 (YEARLY),400000.0,600000.0,,2026-01-15,22 days ago,"System performance monitoring, Computer Science, Unit testing, Engineering, Swift, Bachelor's degree, Stakeholder engagement, Requirements gathering, iOS API integration, Cross-functional communication, Mobile product development, iOS application development, Technical troubleshooting support, UX design, Cross-functional collaboration, Multithreading, iOS, Version control","Min Qualification: Degree Experience Level: Entry level Experience Length: 2 years.  Work closely with cross-functional teams to define requirements, design…",https://www.indeed.com/viewjob?jk=735013f6e04f5675,iOS Developer,Remote
d31d0fa7720a41f1,"Software Engineer, iOS Core Product",Speechify,0.0,0,Remote,True,140000 - 200000 (YEARLY),140000.0,200000.0,,2025-07-21,30+ days ago,"Product strategy, Git, Communication skills, Text-to-speech, Decision making, Software architecture, Swift, Mobile product development, Continuous Delivery (CD) implementation, iOS application development, Product roadmapping, Multithreading, iOS, Version control",Opportunity to lead key engineering and product decisions.  Actively shipping production code for the Speechify iOS app.  An Ideal Candidate Should Have.,https://www.indeed.com/viewjob?jk=d31d0fa7720a41f1,iOS Developer,Remote
7c7e321299a0be7d,"Software Engineer, iOS",Meta,4.0,1133,Remote,True,217000 - 217000 (YEARLY),217000.0,217000.0,,2025-06-25,30+ days ago,"Computer Science, Computer Engineering, Bachelor's degree, Computer science, Scalability, iOS, Scalable systems, System architecture design, Cross-functional communication, iOS application development, Swift, C++, UI development, Mobile product development, Multithreading, Unit testing, Web applications, Back-end development, Cross-functional collaboration","Collaborate with cross-functional teams (product, design, operations, infrastructure) to build innovative application experiences.",https://www.indeed.com/viewjob?jk=7c7e321299a0be7d,iOS Developer,Remote
d3fab7388cb7c07a,QA Engineer,Zazmic Inc,0.0,0,Remote,True,40 - 50 (HOURLY),40.0,50.0,,2026-01-21,17 days ago,"Test case design, Regression testing, Bachelor's degree, User acceptance testing, Android, IT, IT experience within healthcare, HIPAA, Mobile testing, US work authorization, Healthcare IT, Bug Reporting (Quality assurance practices), iOS, SOC 2","Creation of standard test cases based on user stories.  Manual functional testing of the MVP features.  Cross-browser/device testing (Latest versions of Chrome,…",https://www.indeed.com/viewjob?jk=d3fab7388cb7c07a,QA Engineer,Remote
059ee050c410deee,QA Engineer,AutoRABIT Holding Inc.,0.0,0,Remote,True,85000 - 95000 (YEARLY),85000.0,95000.0,,2026-01-14,23 days ago,"Regression testing, Bug Tracking (Quality assurance practices), Usability testing, Agile, Angular, Jira, Communication skills, SaaS, Kanban, UI, Postman (API platform), Performance testing, Salesforce Cloud, Salesforce, Test Planning (Quality assurance practices), Enterprise software, Application deployment, Usability, Bug Reporting (Quality assurance practices)",Verify bug fixes and work with engineers to confirm resolution.  AutoRABIT is a hyper-growth SaaS software company and the leading provider of Salesforce…,https://www.indeed.com/viewjob?jk=059ee050c410deee,QA Engineer,Remote
ada319dcf4953719,Manual QA Engineer,Multi Media LLC,3.0,2,"San Francisco, CA",True,90000 - 115000 (YEARLY),90000.0,115000.0,,2025-12-04,30+ days ago,"JavaScript, Test Planning (Quality assurance practices), Quality assurance within IT, Technical troubleshooting support, Python, Agile","We are looking to bring on a QA Engineer I with experience in manual application testing.  Write test cases for manual testing, and test them with others on the…",https://www.indeed.com/viewjob?jk=ada319dcf4953719,QA Engineer,Remote
9fb9710e568db9ca,QA Analyst,Data Verify,2.6,14,Remote,True,75000 - 85000 (YEARLY),75000.0,85000.0,,2026-02-03,3 days ago,"High school diploma or GED, Computer Science, Bachelor's degree, Bug Tracking (Quality assurance practices), SoapUI, Communication skills, Test Automation Development (Quality assurance practices), Defect detection (quality control), AI, Agile software development, SQL, Postman (API platform), Information Technology, Test management tools, ISTQB Certification, SQL databases, Requirements analysis, IT, Test Planning (Quality assurance practices), Bug Reporting (Quality assurance practices)",The QA Analyst is responsible for ensuring the quality and reliability of software products through systematic testing and analysis.,https://www.indeed.com/viewjob?jk=9fb9710e568db9ca,QA Engineer,Remote
5ba5a68202a713fc,QA Engineer,Tixr,0.0,0,Remote,True,90000 - 120000 (YEARLY),90000.0,120000.0,,2025-07-31,30+ days ago,"Git, Selenium, REST Assured, Scalability, Jira, Communication skills, Debugging, SaaS, Relational databases, Continuous improvement, Pair programming, Agile software development, Postman (API platform), Security Testing, Quality assurance within IT, Cross-functional collaboration, Continuous integration, Automation, Time management, Test Planning (Quality assurance practices), TestNG, Developing automated testing protocols, NoSQL, Version control","Define and Drive QA Strategy: Design and implement scalable, maintainable automated test strategies that spans across manual and automated functional testing…",https://www.indeed.com/viewjob?jk=5ba5a68202a713fc,QA Engineer,Remote
5dacfbd6e35beddc,Software Quality Assurance Analyst - SQL,Data Recognition Corporation,4.1,626,"Maple Grove, MN",True,85000 - 90000 (YEARLY),85000.0,90000.0,,2026-02-06,Just posted,"Database software proficiency, Jira, Debugging, SQL, Bachelor's degree, Bug Tracking (Quality assurance practices), Test management tools, Writing skills, Developing automated testing protocols, UI, Bug Reporting (Quality assurance practices), Software troubleshooting",Software Quality Assurance Analyst (SQA) using SQL.  This position works as part of a project team to implement quality standards across survey programs.,https://www.indeed.com/viewjob?jk=5dacfbd6e35beddc,QA Engineer,Remote
d080c6d7d860698a,Test Engineer - I,OPTiMO Information Technology,0.0,0,Remote,True,N/A,,,,2026-02-04,2 days ago,"WCAG, Analysis skills, Productivity software, Bug Tracking (Quality assurance practices), Usability testing, NVDA, Human-centered design, Jira, Communication skills, Bug Reporting (Quality assurance practices), Load Testing, Agile software development, Project stakeholder communication, Test management tools, Engineering testing, JAWS, Scripting, Automation, Progress tracking (project management tasks), Test Planning (Quality assurance practices), Azure DevOps proficiency, VoiceOver, Developing automated testing protocols, Project reporting",Candidates must be a U.S. Citizen and have the ability to obtain a favorable fitness determination for a Federal Public Trust Clearance.*.,https://www.indeed.com/viewjob?jk=d080c6d7d860698a,QA Engineer,Remote
f45b0af35770a99a,QA Engineer,Cubeseed Africa Ltd,0.0,0,Remote,True,70000 - 150000 (YEARLY),70000.0,150000.0,Contract,2026-01-20,17 days ago,"Web applications, User acceptance testing, Bug Tracking (Quality assurance practices), Test Automation Development (Quality assurance practices), Bug Reporting (Quality assurance practices)",You will work closely with developers and product teams to identify issues early and help deliver high-quality software.,https://www.indeed.com/viewjob?jk=f45b0af35770a99a,QA Engineer,Remote
bc50fe514c39a3aa,Software Quality Analyst II,Solver,3.8,5,Remote,True,85000 - 100000 (YEARLY),85000.0,100000.0,,2026-01-26,11 days ago,"Root cause analysis, Bachelor's degree, Analysis skills, Data visualization, Bug Tracking (Quality assurance practices), Usability testing, Technical documentation, Usability, Database software proficiency, Data reporting, Communication skills, Test Automation Development (Quality assurance practices), Cross-functional communication, Customer support ticket management, Defect detection (quality control), Escalation handling, SQL, Developer tools, Postman (API platform), Quality control documentation, Data interpretation, Automation, Test Planning (Quality assurance practices), Cross-functional collaboration, Customer support, Bug Reporting (Quality assurance practices)","Location: Remote (with occasional travel, department-dependent).  Citizenship Status: U.S. Citizen or Green Card holder required.  Paid time off and holidays.",https://www.indeed.com/viewjob?jk=bc50fe514c39a3aa,QA Engineer,Remote
aac9f9e21e9bc3d6,QA Engineer,"Cloud and Things, Inc",4.2,5,"Albany, NY 12205",True,50000 - 65000 (YEARLY),50000.0,65000.0,,2026-02-05,1 day ago,"Root cause analysis, Regression testing, Analysis skills, Productivity software, Microsoft Access, Bug Tracking (Quality assurance practices), Jira, Communication skills, Debugging, User acceptance testing, Continuous improvement, Cross-functional communication, Load Testing, Defect detection (quality control), Agile software development, SQL, Microsoft Excel, Test Planning (Quality assurance practices), Azure DevOps proficiency, Engineering validation, Cross-functional collaboration, Bug Reporting (Quality assurance practices)","We are seeking a QA Engineer who will support our client by ensuring the reliability, performance, and overall quality of software applications through…",https://www.indeed.com/viewjob?jk=aac9f9e21e9bc3d6,QA Engineer,Remote
2498b8595832a660,Software Quality Engineer III,"DriveCentric, Inc.",3.4,14,Remote,True,N/A,,,,2026-02-04,2 days ago,"Root cause analysis, Selenium, Android, Business requirements, Bug Tracking (Quality assurance practices), iOS, JavaScript, Communication skills, SaaS, Incident management, Test Automation Development (Quality assurance practices), Cross-functional communication, CSS, Defect detection (quality control), Incident response, AI, UI, Postman (API platform), Process optimization, Fiddler, CRM software, Continuous integration, Process improvement, Swagger, Analysis (software development lifecycle), Test Planning (Quality assurance practices), Application deployment, HTML, Bug Reporting (Quality assurance practices)","Identify critical user workflows and collaborate with automation engineers to expand test coverage.  In this role, you'll be instrumental in testing and…",https://www.indeed.com/viewjob?jk=2498b8595832a660,QA Engineer,Remote
